{
  "title": "Python for loop",
  "level": "beginner",
  "target_duration_s": 40,
  "languages": ["en", "hi"],
  "scenes": [
    {
      "id": "s1", "type": "title",
      "narration": { "en": "Let us learn how a Python for loop works.", "hi": "आइए सीखें कि पायथन का फॉर लूप कैसे काम करता है।" },
      "content": { "heading": { "en": "Python for loop", "hi": "पायथन फॉर लूप" }, "subheading": { "en": "Repeat work, one item at a time", "hi": "एक-एक करके काम दोहराएँ" } }
    },
    {
      "id": "s2", "type": "diagram",
      "narration": { "en": "The loop takes each item from a list, runs the body, then moves to the next item.", "hi": "लूप सूची से एक-एक चीज़ लेता है, काम करता है, फिर अगली चीज़ पर जाता है।" },
      "content": {
        "nodes": [
          { "id": "a", "label": { "en": "List", "hi": "सूची" } },
          { "id": "b", "label": { "en": "Next item", "hi": "अगली चीज़" } },
          { "id": "c", "label": { "en": "Run body", "hi": "काम चलाओ" } }
        ],
        "edges": [
          { "from": "a", "to": "b" },
          { "from": "b", "to": "c" },
          { "from": "c", "to": "b", "label": { "en": "repeat", "hi": "दोहराओ" } }
        ]
      }
    },
    {
      "id": "s3", "type": "code",
      "narration": { "en": "Here, fruit takes each name in turn, and print shows it.", "hi": "यहाँ fruit बारी-बारी से हर नाम लेता है, और print उसे दिखाता है।" },
      "content": {
        "language": "python",
        "lines": ["fruits = [\"apple\", \"mango\", \"banana\"]", "for fruit in fruits:", "    print(fruit)"],
        "highlights": [ { "line": 0, "at": 0.0 }, { "line": 1, "at": 0.4 }, { "line": 2, "at": 0.7 } ]
      }
    }
  ]
}
